<?xml version="1.0" encoding="utf-8"?>
<repository xmlns:xsi="http://www.w3.org/2001/XMLSchema-instance" xmlns="urn:malmoe:repository" xsi:schemaLocation="urn:malmoe:repository http://schema.unnsvc.com/malmoe/repository.xsd">

	<identity>
		<groups>
			<group name="testGroup">
				<permission id="repository.read" />
			</group>
		</groups>
		<users>
			<user username="admin" password="+kK0H+KPUDwofoZNox04PTpSQMXfPX9KhCnscqirmow=" salt="EoLwH+02DSEVLrhjXmsffQ==">
				<group ref="testGroup" />
			</user>
		</users>
	</identity>

	<repositories>
		<proxyRepository name="main">
			<access>
				<group ref="testGroup" />
			</access>
			<proxyChain>
				<!-- <repository ref="customMalmoe" /> -->
				<repository ref="customMaven" />
			</proxyChain>
		</proxyRepository>
		<!-- these will download and save artifacts into their own locations -->
		<!-- <virtualRepository name="customMalmoe"> -->
		<!-- <access> -->
		<!-- <group ref="testGroup" /> -->
		<!-- </access> -->
		<!-- <resolver name="malmoe" url="http://someMalmoeLocation/" /> -->
		<!-- </virtualRepository> -->
		<virtualRepository name="customMaven">
			<access>
				<group ref="testGroup" />
			</access>
			<resolver name="maven" url="http://central.maven.org/maven2/" />
		</virtualRepository>
	</repositories>

</repository>
